{
  "created_at": "2026-09-17T22:14:51.713277Z",
  "idempotency_key": "intake-claude-v3-remediation-1",
  "input_fingerprint": {
    "algorithm": "sha256",
    "value": "b9c9f47df8812563c4f092a6fa86f0433fb70a5941d34baa2930d2317e929fe8"
  },
  "next_action": {
    "description": "Inspect the repository and accessible references, synthesize what is known, then ask only for material decisions that cannot be determined.",
    "owner": {
      "actor_id": "agent:workbench",
      "kind": "agent"
    },
    "target_id": "INTAKE-WB-20260917-CLAUDE-V3-REMEDIATION",
    "target_type": "evidence"
  },
  "owner": {
    "actor_id": "user:vince",
    "kind": "human"
  },
  "planning_destination": null,
  "raw_request": "$vince-skills:workbench  come up with a plan to fix claude from the v3 findings",
  "record_type": "workbench-intake",
  "route": null,
  "schema_version": "0.1.0",
  "source_references": [
    "claude test v3.md",
    "WB-20260916-CLAUDE-INSTRUCTION-OPTIMIZATION"
  ],
  "status": "captured",
  "work_id": "WB-20260917-CLAUDE-V3-REMEDIATION"
}
