{
  "created_at": "2026-09-17T22:51:03.995603Z",
  "idempotency_key": "intake-claude-optimization-loop-1",
  "input_fingerprint": {
    "algorithm": "sha256",
    "value": "fd810c8f9f99fbb96bfed9edebdc67075e2709a11ae69ce59b0bb3ff47172ca5"
  },
  "next_action": {
    "description": "Inspect the repository and accessible references, synthesize what is known, then ask only for material decisions that cannot be determined.",
    "owner": {
      "actor_id": "agent:workbench",
      "kind": "agent"
    },
    "target_id": "INTAKE-WB-20260917-CLAUDE-OPTIMIZATION-LOOP",
    "target_type": "evidence"
  },
  "owner": {
    "actor_id": "user:vince",
    "kind": "human"
  },
  "planning_destination": null,
  "raw_request": "do it",
  "record_type": "workbench-intake",
  "route": null,
  "schema_version": "0.1.0",
  "source_references": [
    "WB-20260917-CLAUDE-V3-REMEDIATION",
    ".workbench/work/WB-20260917-CLAUDE-V3-REMEDIATION/artifacts/implementation-plan.md"
  ],
  "status": "captured",
  "work_id": "WB-20260917-CLAUDE-OPTIMIZATION-LOOP"
}
