{
  "created_at": "2026-09-17T01:46:48.319353Z",
  "idempotency_key": "capture-claude-instruction-optimization-v1",
  "input_fingerprint": {
    "algorithm": "sha256",
    "value": "919e263b319edd21d29d9afa41267f463b1052c80cd59b7f39ea74aac0ed7467"
  },
  "next_action": {
    "description": "Inspect the repository and accessible references, synthesize what is known, then ask only for material decisions that cannot be determined.",
    "owner": {
      "actor_id": "agent:workbench",
      "kind": "agent"
    },
    "target_id": "INTAKE-WB-20260916-CLAUDE-INSTRUCTION-OPTIMIZATION",
    "target_type": "evidence"
  },
  "owner": {
    "actor_id": "user:vince",
    "kind": "human"
  },
  "planning_destination": null,
  "raw_request": "we need to iterate over this repeatedly until the new instructions pass. so, the loop is to test -> implement fix -> test fix ->implement new fix. .. etc continue until the results are satisfactory or you hit a real stopping point and theres no way to improve further",
  "record_type": "workbench-intake",
  "route": null,
  "schema_version": "0.1.0",
  "source_references": [
    "C:\\Users\\vince\\.claude\\CLAUDE.md",
    "WB-20260916-CLAUDE-CODE-PARITY-LOOP",
    "WB-20260916-CLAUDE-PARITY-IMPLEMENTATION",
    "WB-20260916-CLAUDE-PARITY-LIVE-RUNNER"
  ],
  "status": "captured",
  "work_id": "WB-20260916-CLAUDE-INSTRUCTION-OPTIMIZATION"
}
